[
  {
    "id": "aries-00",
    "sign_id": "aries",
    "degree_in_sign": 0,
    "sabian_symbol": null,
    "dwad_sign_id": "aries",
    "notes_markdown": "",
    "source_ids": []
  },
  {
    "id": "aries-01",
    "sign_id": "aries",
    "degree_in_sign": 1,
    "sabian_symbol": null,
    "dwad_sign_id": "aries",
    "notes_markdown": "",
    "source_ids": []
  },
  {
    "id": "aries-02",
    "sign_id": "aries",
    "degree_in_sign": 2,
    "sabian_symbol": null,
    "dwad_sign_id": "aries",
    "notes_markdown": "",
    "source_ids": []
  },
  {
    "id": "aries-03",
    "sign_id": "aries",
    "degree_in_sign": 3,
    "sabian_symbol": null,
    "dwad_sign_id": "taurus",
    "notes_markdown": "",
    "source_ids": []
  },
  {
    "id": "aries-04",
    "sign_id": "aries",
    "degree_in_sign": 4,
    "sabian_symbol": null,
    "dwad_sign_id": "taurus",
    "notes_markdown": "",
    "source_ids": []
  },
  {
    "id": "aries-05",
    "sign_id": "aries",
    "degree_in_sign": 5,
    "sabian_symbol": null,
    "dwad_sign_id": "gemini",
    "notes_markdown": "",
    "source_ids": []
  },
  {
    "id": "aries-06",
    "sign_id": "aries",
    "degree_in_sign": 6,
    "sabian_symbol": null,
    "dwad_sign_id": "gemini",
    "notes_markdown": "",
    "source_ids": []
  },
  {
    "id": "aries-07",
    "sign_id": "aries",
    "degree_in_sign": 7,
    "sabian_symbol": null,
    "dwad_sign_id": "gemini",
    "notes_markdown": "",
    "source_ids": []
  },
  {
    "id": "aries-08",
    "sign_id": "aries",
    "degree_in_sign": 8,
    "sabian_symbol": null,
    "dwad_sign_id": "cancer",
    "notes_markdown": "",
    "source_ids": []
  },
  {
    "id": "aries-09",
    "sign_id": "aries",
    "degree_in_sign": 9,
    "sabian_symbol": null,
    "dwad_sign_id": "cancer",
    "notes_markdown": "",
    "source_ids": []
  },
  {
    "id": "aries-10",
    "sign_id": "aries",
    "degree_in_sign": 10,
    "sabian_symbol": null,
    "dwad_sign_id": "leo",
    "notes_markdown": "",
    "source_ids": []
  },
  {
    "id": "aries-11",
    "sign_id": "aries",
    "degree_in_sign": 11,
    "sabian_symbol": null,
    "dwad_sign_id": "leo",
    "notes_markdown": "",
    "source_ids": []
  },
  {
    "id": "aries-12",
    "sign_id": "aries",
    "degree_in_sign": 12,
    "sabian_symbol": null,
    "dwad_sign_id": "leo",
    "notes_markdown": "",
    "source_ids": []
  },
  {
    "id": "aries-13",
    "sign_id": "aries",
    "degree_in_sign": 13,
    "sabian_symbol": null,
    "dwad_sign_id": "virgo",
    "notes_markdown": "",
    "source_ids": []
  },
  {
    "id": "aries-14",
    "sign_id": "aries",
    "degree_in_sign": 14,
    "sabian_symbol": null,
    "dwad_sign_id": "virgo",
    "notes_markdown": "",
    "source_ids": []
  },
  {
    "id": "aries-15",
    "sign_id": "aries",
    "degree_in_sign": 15,
    "sabian_symbol": null,
    "dwad_sign_id": "libra",
    "notes_markdown": "",
    "source_ids": []
  },
  {
    "id": "aries-16",
    "sign_id": "aries",
    "degree_in_sign": 16,
    "sabian_symbol": null,
    "dwad_sign_id": "libra",
    "notes_markdown": "",
    "source_ids": []
  },
  {
    "id": "aries-17",
    "sign_id": "aries",
    "degree_in_sign": 17,
    "sabian_symbol": null,
    "dwad_sign_id": "libra",
    "notes_markdown": "",
    "source_ids": []
  },
  {
    "id": "aries-18",
    "sign_id": "aries",
    "degree_in_sign": 18,
    "sabian_symbol": null,
    "dwad_sign_id": "scorpio",
    "notes_markdown": "",
    "source_ids": []
  },
  {
    "id": "aries-19",
    "sign_id": "aries",
    "degree_in_sign": 19,
    "sabian_symbol": null,
    "dwad_sign_id": "scorpio",
    "notes_markdown": "",
    "source_ids": []
  },
  {
    "id": "aries-20",
    "sign_id": "aries",
    "degree_in_sign": 20,
    "sabian_symbol": null,
    "dwad_sign_id": "sagittarius",
    "notes_markdown": "",
    "source_ids": []
  },
  {
    "id": "aries-21",
    "sign_id": "aries",
    "degree_in_sign": 21,
    "sabian_symbol": null,
    "dwad_sign_id": "sagittarius",
    "notes_markdown": "",
    "source_ids": []
  },
  {
    "id": "aries-22",
    "sign_id": "aries",
    "degree_in_sign": 22,
    "sabian_symbol": null,
    "dwad_sign_id": "sagittarius",
    "notes_markdown": "",
    "source_ids": []
  },
  {
    "id": "aries-23",
    "sign_id": "aries",
    "degree_in_sign": 23,
    "sabian_symbol": null,
    "dwad_sign_id": "capricorn",
    "notes_markdown": "",
    "source_ids": []
  },
  {
    "id": "aries-24",
    "sign_id": "aries",
    "degree_in_sign": 24,
    "sabian_symbol": null,
    "dwad_sign_id": "capricorn",
    "notes_markdown": "",
    "source_ids": []
  },
  {
    "id": "aries-25",
    "sign_id": "aries",
    "degree_in_sign": 25,
    "sabian_symbol": null,
    "dwad_sign_id": "aquarius",
    "notes_markdown": "",
    "source_ids": []
  },
  {
    "id": "aries-26",
    "sign_id": "aries",
    "degree_in_sign": 26,
    "sabian_symbol": null,
    "dwad_sign_id": "aquarius",
    "notes_markdown": "",
    "source_ids": []
  },
  {
    "id": "aries-27",
    "sign_id": "aries",
    "degree_in_sign": 27,
    "sabian_symbol": null,
    "dwad_sign_id": "aquarius",
    "notes_markdown": "",
    "source_ids": []
  },
  {
    "id": "aries-28",
    "sign_id": "aries",
    "degree_in_sign": 28,
    "sabian_symbol": null,
    "dwad_sign_id": "pisces",
    "notes_markdown": "",
    "source_ids": []
  },
  {
    "id": "aries-29",
    "sign_id": "aries",
    "degree_in_sign": 29,
    "sabian_symbol": null,
    "dwad_sign_id": "pisces",
    "notes_markdown": "",
    "source_ids": []
  },
  {
    "id": "taurus-00",
    "sign_id": "taurus",
    "degree_in_sign": 0,
    "sabian_symbol": null,
    "dwad_sign_id": "taurus",
    "notes_markdown": "",
    "source_ids": []
  },
  {
    "id": "taurus-01",
    "sign_id": "taurus",
    "degree_in_sign": 1,
    "sabian_symbol": null,
    "dwad_sign_id": "taurus",
    "notes_markdown": "",
    "source_ids": []
  },
  {
    "id": "taurus-02",
    "sign_id": "taurus",
    "degree_in_sign": 2,
    "sabian_symbol": null,
    "dwad_sign_id": "taurus",
    "notes_markdown": "",
    "source_ids": []
  },
  {
    "id": "taurus-03",
    "sign_id": "taurus",
    "degree_in_sign": 3,
    "sabian_symbol": null,
    "dwad_sign_id": "gemini",
    "notes_markdown": "",
    "source_ids": []
  },
  {
    "id": "taurus-04",
    "sign_id": "taurus",
    "degree_in_sign": 4,
    "sabian_symbol": null,
    "dwad_sign_id": "gemini",
    "notes_markdown": "",
    "source_ids": []
  },
  {
    "id": "taurus-05",
    "sign_id": "taurus",
    "degree_in_sign": 5,
    "sabian_symbol": null,
    "dwad_sign_id": "cancer",
    "notes_markdown": "",
    "source_ids": []
  },
  {
    "id": "taurus-06",
    "sign_id": "taurus",
    "degree_in_sign": 6,
    "sabian_symbol": null,
    "dwad_sign_id": "cancer",
    "notes_markdown": "",
    "source_ids": []
  },
  {
    "id": "taurus-07",
    "sign_id": "taurus",
    "degree_in_sign": 7,
    "sabian_symbol": null,
    "dwad_sign_id": "cancer",
    "notes_markdown": "",
    "source_ids": []
  },
  {
    "id": "taurus-08",
    "sign_id": "taurus",
    "degree_in_sign": 8,
    "sabian_symbol": null,
    "dwad_sign_id": "leo",
    "notes_markdown": "",
    "source_ids": []
  },
  {
    "id": "taurus-09",
    "sign_id": "taurus",
    "degree_in_sign": 9,
    "sabian_symbol": null,
    "dwad_sign_id": "leo",
    "notes_markdown": "",
    "source_ids": []
  },
  {
    "id": "taurus-10",
    "sign_id": "taurus",
    "degree_in_sign": 10,
    "sabian_symbol": null,
    "dwad_sign_id": "virgo",
    "notes_markdown": "",
    "source_ids": []
  },
  {
    "id": "taurus-11",
    "sign_id": "taurus",
    "degree_in_sign": 11,
    "sabian_symbol": null,
    "dwad_sign_id": "virgo",
    "notes_markdown": "",
    "source_ids": []
  },
  {
    "id": "taurus-12",
    "sign_id": "taurus",
    "degree_in_sign": 12,
    "sabian_symbol": null,
    "dwad_sign_id": "virgo",
    "notes_markdown": "",
    "source_ids": []
  },
  {
    "id": "taurus-13",
    "sign_id": "taurus",
    "degree_in_sign": 13,
    "sabian_symbol": null,
    "dwad_sign_id": "libra",
    "notes_markdown": "",
    "source_ids": []
  },
  {
    "id": "taurus-14",
    "sign_id": "taurus",
    "degree_in_sign": 14,
    "sabian_symbol": null,
    "dwad_sign_id": "libra",
    "notes_markdown": "",
    "source_ids": []
  },
  {
    "id": "taurus-15",
    "sign_id": "taurus",
    "degree_in_sign": 15,
    "sabian_symbol": null,
    "dwad_sign_id": "scorpio",
    "notes_markdown": "",
    "source_ids": []
  },
  {
    "id": "taurus-16",
    "sign_id": "taurus",
    "degree_in_sign": 16,
    "sabian_symbol": null,
    "dwad_sign_id": "scorpio",
    "notes_markdown": "",
    "source_ids": []
  },
  {
    "id": "taurus-17",
    "sign_id": "taurus",
    "degree_in_sign": 17,
    "sabian_symbol": null,
    "dwad_sign_id": "scorpio",
    "notes_markdown": "",
    "source_ids": []
  },
  {
    "id": "taurus-18",
    "sign_id": "taurus",
    "degree_in_sign": 18,
    "sabian_symbol": null,
    "dwad_sign_id": "sagittarius",
    "notes_markdown": "",
    "source_ids": []
  },
  {
    "id": "taurus-19",
    "sign_id": "taurus",
    "degree_in_sign": 19,
    "sabian_symbol": null,
    "dwad_sign_id": "sagittarius",
    "notes_markdown": "",
    "source_ids": []
  },
  {
    "id": "taurus-20",
    "sign_id": "taurus",
    "degree_in_sign": 20,
    "sabian_symbol": null,
    "dwad_sign_id": "capricorn",
    "notes_markdown": "",
    "source_ids": []
  },
  {
    "id": "taurus-21",
    "sign_id": "taurus",
    "degree_in_sign": 21,
    "sabian_symbol": null,
    "dwad_sign_id": "capricorn",
    "notes_markdown": "",
    "source_ids": []
  },
  {
    "id": "taurus-22",
    "sign_id": "taurus",
    "degree_in_sign": 22,
    "sabian_symbol": null,
    "dwad_sign_id": "capricorn",
    "notes_markdown": "",
    "source_ids": []
  },
  {
    "id": "taurus-23",
    "sign_id": "taurus",
    "degree_in_sign": 23,
    "sabian_symbol": null,
    "dwad_sign_id": "aquarius",